WEO Country Group Code	WEO Subject Code	Country Group Name	Subject Descriptor	Subject Notes	Units	Scale	Series-specific Notes	1980	1981	1982	1983	1984	1985	1986	1987	1988	1989	1990	1991	1992	1993	1994	1995	1996	1997	1998	1999	2000	2001	2002	2003	2004	2005	2006	2007	2008	2009	2010	2011	2012	2013	2014	2015	2016	2017	2018	2019	2020	Estimates Start After
001	NGDP_RPCH	World	Gross domestic product, constant prices		Percent change			2.250	2.287	0.764	2.787	4.826	3.925	3.370	3.816	4.607	3.874	3.419	2.486	2.348	2.163	3.323	3.368	3.927	4.100	2.562	3.635	4.821	2.515	2.960	4.055	5.185	4.872	5.544	5.702	3.064	0.028	5.431	4.225	3.426	3.308	3.428	3.123	3.560	3.805	3.903	3.957	3.968	
001	NGDP_RPCHMK	World	Gross domestic product, constant prices		Percent change (market exchange rates)			1.731	2.223	0.501	2.869	4.933	3.879	3.219	3.671	4.672	3.861	3.125	1.848	2.545	1.521	3.184	2.831	3.283	3.564	2.234	3.203	4.182	1.685	1.979	2.893	3.985	3.516	4.023	3.922	1.510	-1.994	4.148	3.007	2.446	2.396	2.661	2.486	2.963	3.207	3.292	3.274	3.235	
001	NGDPD	World	Gross domestic product, current prices		U.S. dollars	Billions		11,137.260	11,361.191	11,137.567	11,416.500	11,835.925	12,269.914	14,435.897	16,565.098	18,591.997	19,527.001	23,216.147	24,538.377	24,938.900	25,662.752	27,547.656	30,680.504	31,534.620	31,476.231	31,277.708	32,400.629	33,455.710	33,297.964	34,305.490	38,573.519	43,448.255	47,028.264	50,946.303	57,515.769	63,014.306	59,682.893	65,338.933	72,422.521	73,777.260	75,467.066	77,269.168	73,506.822	76,321.315	80,719.598	85,436.683	90,575.154	96,193.497	
001	NGDP_D	World	Gross domestic product, deflator		Index, 2000=100																																												
001	NGAP_NPGDP	World	Output gap		Percent of potential GDP																																												
001	PPPGDP	World	Gross domestic product based on purchasing-power-parity (PPP) valuation of country GDP		Current international dollar	Billions		12,990.062	14,501.381	15,492.799	16,527.183	17,917.993	19,209.033	20,231.241	21,521.056	23,264.326	25,074.736	26,877.555	28,406.190	32,276.224	33,726.797	35,495.640	37,569.506	39,725.848	42,110.457	43,608.124	45,842.290	49,143.951	51,489.067	53,795.140	57,031.457	61,845.597	66,879.753	72,672.742	78,742.949	82,644.273	83,044.764	88,523.115	94,012.764	98,713.552	103,554.468	108,777.213	113,162.221	118,518.501	125,117.825	132,615.503	140,793.802	149,463.948	
001	PPPPC	World	Gross domestic product based on purchasing-power-parity (PPP) per capita GDP		Current international dollar	Units																																											
001	PPPSH	World	Gross domestic product based on purchasing-power-parity (PPP) share of world total	These data form the basis for the country weights used to generate the World Economic Outlook country group composites for the domestic economy.   Please note:   The IMF is not a primary source for purchasing power parity (PPP) data. WEO weights have been created from primary sources and are used solely for purposes of generating country group composites. For primary source information, please refer to one of the following sources: the Organization for Economic Cooperation and Development, the World Bank, or the Penn World Tables.  For further information see Box A2 in the April 2004 World Economic Outlook, Box 1.2 in the September 2003 World Economic Outlook for a discussion on the measurement of global growth and Box A.1 in the May 2000 World Economic Outlook for a summary of the revised PPP-based weights, and Annex IV of the May 1993 World Economic Outlook. See also Anne Marie Gulde and Marianne Schulze-Ghattas, "Purchasing Power Parity Based Weights for the World Economic Outlook," in Staff Studies for the World Economic Outlook (Washington: IMF, December 1993), pp. 106-23.	Percent																																												
001	NID_NGDP	World	Investment		Percent of GDP			26.029	25.566	24.002	23.622	24.641	24.421	24.235	24.532	25.395	26.040	25.786	25.497	24.014	23.654	23.788	23.935	23.829	23.898	23.480	23.410	23.853	23.130	22.433	22.724	23.428	23.760	24.365	24.975	24.919	22.826	24.050	24.767	24.857	24.792	25.005	25.159	25.181	25.297	25.394	25.451	25.487	
001	NGSD_NGDP	World	Gross national savings		Percent of GDP			23.901	23.616	22.195	21.554	22.700	22.338	22.378	23.045	24.193	24.194	24.606	23.122	22.567	22.538	22.911	23.364	23.390	23.698	23.363	23.155	23.818	22.964	22.258	22.572	23.489	23.991	25.181	25.391	24.930	22.981	24.419	25.258	25.580	25.513	25.736	25.644	25.384	25.340	25.327	25.294	25.244	
001	PCPIPCH	World	Inflation, average consumer prices		Percent change			17.416	15.255	14.181	13.400	14.218	13.704	11.705	14.644	19.797	23.647	26.719	17.336	39.584	39.804	31.740	16.386	9.531	6.674	6.423	6.097	4.858	4.645	3.726	3.944	3.841	4.084	4.088	4.340	6.412	2.768	3.786	5.151	4.180	3.857	3.450	3.310	3.417	3.559	3.474	3.503	3.509	
001	PCPIEPCH	World	Inflation, end of period consumer prices		Percent change			n/a	n/a	n/a	n/a	n/a	16.436	9.767	18.568	23.488	25.178	25.344	18.836	42.577	42.342	25.989	12.751	8.144	6.045	7.259	5.140	4.853	3.981	4.112	3.596	4.040	4.035	3.952	5.418	4.714	3.320	4.452	4.868	4.065	3.561	3.159	3.553	3.456	3.522	3.413	3.490	3.469	
001	FLIBOR3	World	Three-month London interbank offered rate (LIBOR)		Percent																																												
001	TRADEPCH	World	Trade volume of goods and services		Percent change			3.137	2.862	-1.844	1.417	8.687	2.755	4.285	6.364	8.858	8.279	6.887	5.245	5.573	2.913	9.346	9.798	7.076	9.971	4.712	4.908	12.092	0.216	3.771	5.435	11.016	7.688	9.242	7.915	2.903	-10.327	12.517	6.666	2.911	3.331	3.349	3.176	4.077	4.647	4.603	4.650	4.635	
001	TM_RPCH	World	Volume of imports of goods and services		Percent change			1.701	2.088	-1.634	1.605	8.874	2.383	5.004	7.059	8.709	8.612	6.758	4.510	5.255	2.055	10.176	9.807	7.625	9.782	4.871	5.536	12.377	0.374	3.811	5.702	11.373	7.855	9.043	8.075	2.975	-10.551	12.452	6.835	2.759	3.199	3.502	2.991	4.268	4.840	4.750	4.738	4.725	
001	TMG_RPCH	World	Volume of imports of goods		Percent change			1.177	1.460	-1.466	2.753	9.283	3.477	5.734	6.706	9.915	7.664	6.857	5.198	6.341	3.392	9.630	10.607	7.697	9.917	5.217	6.454	12.477	0.101	3.950	6.783	11.298	8.070	9.077	7.524	2.757	-12.138	14.055	7.038	2.102	2.804	3.075	2.892	4.133	4.885	4.871	4.846	4.833	
001	TX_RPCH	World	Volume of exports of goods and services		Percent change			4.555	3.606	-2.043	1.238	8.510	3.111	3.602	5.695	9.004	7.955	7.013	5.964	5.880	3.734	8.564	9.788	6.551	10.154	4.559	4.303	11.814	0.061	3.731	5.172	10.663	7.521	9.440	7.756	2.831	-10.103	12.582	6.498	3.063	3.462	3.196	3.360	3.888	4.454	4.457	4.562	4.545	
001	TXG_RPCH	World	Volume of exports of goods		Percent change			4.039	3.552	-2.384	1.528	8.838	3.345	3.023	6.114	9.312	7.533	6.455	5.922	6.274	3.897	8.965	10.384	6.531	10.637	4.613	5.211	11.780	0.202	3.803	5.658	10.170	7.516	9.441	6.931	2.198	-11.420	14.549	6.390	2.907	3.226	3.071	3.056	3.699	4.295	4.356	4.470	4.452	
001	TTPCH	World	Terms of trade of goods and services		Percent change																																												
001	TTTPCH	World	Terms of trade of goods		Percent change																																												
001	TXGM_D	World	Export price of manufactures		U.S. dollars; index, 2000=100																																												
001	TXGM_DPCH	World	Export price of manufactures		U.S. dollars; annual percent change																																												
001	LUR	World	Unemployment rate		Percent of total labor force																																												
001	LE	World	Employment		Index, 2000=100																																												
001	GGR_NGDP	World	General government revenue	Revenue consists of taxes, social contributions, grants receivable, and other revenue. Revenue increases government?s net worth, which is the difference between its assets and liabilities (GFSM 2001, paragraph 4.20). Note: Transactions that merely change the composition of the balance sheet do not change the net worth position, for example, proceeds from sales of nonfinancial and financial assets or incurrence of liabilities.	Percent of GDP																																												
001	GGX_NGDP	World	General government total expenditure	Total expenditure consists of total expense and the net acquisition of nonfinancial assets. Note: Apart from being on an accrual basis, total expenditure differs from the GFSM 1986 definition of total expenditure in the sense that it also takes the disposals of nonfinancial assets into account.	Percent of GDP																																												
001	GGXCNL_NGDP	World	General government net lending/borrowing	Net lending (+)/ borrowing (?) is calculated as revenue minus total expenditure. This is a core GFS balance that measures the extent to which general government is either putting financial resources at the disposal of other sectors in the economy and nonresidents (net lending), or utilizing the financial resources generated by other sectors and nonresidents (net borrowing). This balance may be viewed as an indicator of the financial impact of general government activity on the rest of the economy and nonresidents (GFSM 2001, paragraph 4.17). Note: Net lending (+)/borrowing (?) is also equal to net acquisition of financial assets minus net incurrence of liabilities.	Percent of GDP																																												
001	GGSB_NPGDP	World	General government structural balance		Percent of potential GDP																																												
001	GGXONLB_NGDP	World	General government primary net lending/borrowing	Primary net lending/borrowing is net lending (+)/borrowing (?) plus net interest payable/paid (interest expense minus interest revenue).	Percent of GDP																																												
001	GGXWDN_NGDP	World	General government net debt	Net debt is calculated as gross debt minus financial assets corresponding to debt instruments. These financial assets are: monetary gold and SDRs, currency and deposits, debt securities, loans, insurance, pension, and standardized guarantee schemes, and other accounts receivable.	Percent of GDP																																												
001	GGXWDG_NGDP	World	General government gross debt	Gross debt consists of all liabilities that require payment or payments of interest and/or principal by the debtor to the creditor at a date or dates in the future. This includes debt liabilities in the form of SDRs, currency and deposits, debt securities, loans, insurance, pensions and standardized guarantee schemes, and other accounts payable. Thus, all liabilities in the GFSM 2001 system are debt, except for equity and investment fund shares and financial derivatives and employee stock options. Debt can be valued at current market, nominal, or face values (GFSM 2001, paragraph 7.110).	Percent of GDP																																												
001	BCA	World	Current account balance	Current account is all transactions other than those in financial and capital items. The major classifications are goods and services, income and current transfers. The focus of the BOP is on transactions (between an economy and the rest of the world) in goods, services, and income. Data for the world total reflects errors, omissions, and asymmetries in balance of payments statistics on current account, as well as the exclusion of data for international organizations and a limited number of countries. Calculated as the sum of the balance of individual countries.	U.S. dollars	Billions		-58.156	-86.645	-102.437	-86.379	-82.226	-71.516	-69.044	-71.237	-63.519	-90.247	-114.870	-144.033	-122.171	-52.822	-73.918	-70.414	-58.372	5.437	-68.872	-96.143	-148.819	-171.551	-130.338	-60.458	24.329	77.707	215.071	269.675	97.994	165.870	283.774	343.798	350.892	374.230	347.542	206.203	86.105	-29.661	-123.212	-207.000	-302.490	
001	BCA_NGDPD	World	Current account balance		Percent of GDP																																												
001	BM	World	Imports of goods and services		U.S. dollars	Billions																																											
001	BX	World	Exports of goods and services		U.S. dollars	Billions																																											
001	BF	World	Financial account balance		U.S. dollars	Billions																																											
001	BFD	World	Direct investment, net		U.S. dollars	Billions																																											
001	BFP	World	Portfolio investment, net		U.S. dollars	Billions																																											
001	BFF	World	Financial derivatives, net		U.S. dollars	Billions																																											
001	BFO	World	Other investment, net		U.S. dollars	Billions																																											
001	BFRA	World	Change in reserves		U.S. dollars	Billions																																											
001	D	World	External debt, total		U.S. dollars	Billions																																											
001	D_NGDPD	World	External debt, total		Percent of GDP																																												
001	D_BX	World	External debt, total		Percent of exports of goods and services																																												
001	DS	World	External debt, total debt service		U.S. dollars	Billions																																											
001	DS_NGDPD	World	External debt, total debt service		Percent of GDP																																												
001	DS_BX	World	External debt, total debt service		Percent of exports of goods and services																																												
001	DSI	World	External debt, total debt service, interest		U.S. dollars	Billions																																											
001	DSI_NGDPD	World	External debt, total debt service, interest		Percent of GDP																																												
001	DSI_BX	World	External debt, total debt service, interest		Percent of exports of goods and services																																												
001	DSP	World	External debt, total debt service, amortization		U.S. dollars	Billions																																											
001	DSP_NGDPD	World	External debt, total debt service, amortization		Percent of GDP																																												
001	DSP_BX	World	External debt, total debt service, amortization		Percent of exports of goods and services																																												
001	PALLFNFW	World	Commodity Price Index includes both Fuel and Non-Fuel Price Indices		Index, 2005=100			n/a	n/a	n/a	n/a	n/a	n/a	n/a	n/a	n/a	n/a	n/a	n/a	54.766	52.441	54.635	59.055	62.036	59.416	47.635	49.830	63.060	58.351	58.143	64.979	80.412	100.000	120.651	134.816	172.225	120.529	152.086	191.889	185.654	182.877	171.474	112.330	107.828	113.085	117.529	119.588	120.097	
001	PNFUELW	World	Commodity Non-Fuel Price Index includes Food and Beverages and Industrial Inputs Price Indices		Index, 2005=100			101.200	90.491	82.544	86.454	85.948	77.183	78.757	88.229	102.438	95.741	94.048	86.227	84.284	84.528	93.349	100.279	99.047	95.703	82.977	76.146	79.076	76.026	76.876	81.647	94.088	100.000	123.078	140.159	151.301	127.438	161.249	190.039	170.988	168.994	162.279	134.893	127.972	128.363	128.347	127.543	126.725	
001	PINDUW	World	Commodity Industrial Inputs Price Index includes Agricultural Raw Materials and Metals Price Indices		Index, 2005=100			72.947	60.709	54.281	61.256	60.698	53.370	56.387	72.080	93.687	90.659	85.951	75.850	74.304	74.936	85.128	94.485	87.108	86.195	71.680	71.261	77.674	72.536	71.321	75.265	89.080	100.000	136.289	154.313	145.676	118.664	169.938	197.756	167.128	163.316	153.503	125.394	117.732	116.941	116.945	116.295	115.571	
001	POILAPSP	World	Crude Oil (petroleum), simple average of three spot prices; Dated Brent, West Texas Intermediate, and the Dubai Fateh, US$ per barrel	The APSP denotes an equally weighted average of three crude oil spot prices?West Texas Intermediate (?WTI?), Dated Brent (?Brent?), and Dubai Fateh (?Dubai?). The prices of these crude oils tend to move together according to the inequality WTI > Brent > Dubai. Their price differentials reflect differences in American Petroleum Institute (API) measure of gravity, sulfur content, and overall weight. The WTI spot price refers to the physical delivery price for a barrel of WTI deliverable to Cushing, Oklahoma. The WTI price is frequently mentioned in the financial press, and is often described as the ?headline? oil price. The Brent spot price is the physical delivery price for a barrel of either Dated Brent (UK), Forties (Norway), or Oseberg (Norway) to Sullom Voe, United Kingdom (in the Shetland Islands). The Dubai Fateh spot price refers to the physical price for a barrel of Dubai Fateh deliverable in the Arabian Gulf at Dubai, United Arab Emirates.	U.S. dollars	Units		35.707	34.038	31.544	29.469	28.546	27.371	14.172	18.198	14.769	17.906	22.985	19.368	19.036	16.787	15.948	17.204	20.373	19.268	13.074	17.981	28.234	24.331	24.950	28.892	37.760	53.354	64.273	71.128	97.035	61.777	79.030	104.008	105.007	104.069	96.247	51.623	50.359	55.421	59.838	62.178	62.966	
001	POILBRE	World	Crude Oil (petroleum),  Dated Brent, light blend 38 API, fob U.K., US$ per barrel		U.S. dollars	Units		37.892	36.676	33.418	29.783	28.743	27.611	14.433	18.436	14.975	18.248	23.711	19.982	19.414	16.998	15.826	17.056	20.453	19.116	12.719	17.699	28.308	24.412	24.998	28.853	38.298	54.434	65.390	72.713	97.660	61.861	79.631	110.952	111.960	108.844	98.943	53.420	53.048	58.420	62.538	64.591	65.737	
001	POILDUB	World	Oil; Dubai, medium, Fateh 32 API, fob Dubai Crude Oil (petroleum), Dubai Fateh Fateh 32 API, US$ per barrel		U.S. dollars	Units		35.846	34.294	31.757	28.468	27.509	26.508	13.056	16.964	13.360	15.781	20.730	16.607	17.138	14.906	14.832	16.128	18.537	18.102	12.090	17.076	26.085	22.710	23.734	26.733	33.456	49.202	61.432	68.368	93.777	61.755	78.058	106.027	108.919	105.430	96.664	52.901	50.390	55.030	59.554	61.958	61.391	
001	POILWTI	World	Crude Oil (petroleum), West Texas Intermediate 40 API, Midland Texas, US$ per barrel		U.S. dollars	Units		37.879	36.168	32.670	30.604	29.388	27.992	15.024	19.193	15.972	19.692	24.518	21.512	20.555	18.455	17.183	18.432	22.132	20.585	14.416	19.166	30.315	25.869	26.116	31.095	41.445	56.444	66.053	72.285	99.588	61.690	79.401	95.046	94.143	97.934	93.135	48.549	47.640	52.814	57.422	59.985	61.772	
001	PNRGW	World	Commodity Fuel (energy) Index includes Crude oil (petroleum), Natural Gas, and Coal Price Indices		Index, 2005=100			n/a	n/a	n/a	n/a	n/a	n/a	n/a	n/a	n/a	n/a	n/a	n/a	37.497	33.670	31.987	34.938	40.384	38.187	26.959	34.434	53.691	48.011	47.183	55.228	72.411	100.000	119.231	131.690	184.466	116.486	146.726	192.970	194.234	190.998	176.853	99.130	96.043	104.147	111.200	114.934	116.219	
001	POILAPSPW	World	Crude Oil (petroleum), Price index simple average of three spot prices (APSP); Dated Brent, West Texas Intermediate, and the Dubai Fateh	The APSP denotes an equally weighted average of three crude oil spot prices?West Texas Intermediate (?WTI?), Dated Brent (?Brent?), and Dubai Fateh (?Dubai?). The prices of these crude oils tend to move together according to the inequality WTI > Brent > Dubai. Their price differentials reflect differences in American Petroleum Institute (API) measure of gravity, sulfur content, and overall weight. The WTI spot price refers to the physical delivery price for a barrel of WTI deliverable to Cushing, Oklahoma. The WTI price is frequently mentioned in the financial press, and is often described as the ?headline? oil price. The Brent spot price is the physical delivery price for a barrel of either Dated Brent (UK), Forties (Norway), or Oseberg (Norway) to Sullom Voe, United Kingdom (in the Shetland Islands). The Dubai Fateh spot price refers to the physical price for a barrel of Dubai Fateh deliverable in the Arabian Gulf at Dubai, United Arab Emirates.	Index, 2005=100			66.924	63.797	59.122	55.233	53.503	51.300	26.561	34.109	27.681	33.560	43.080	36.300	35.678	31.463	29.891	32.245	38.185	36.112	24.504	33.701	52.918	45.602	46.763	54.151	70.772	100.000	120.464	133.312	181.870	115.787	148.124	194.939	196.812	195.054	180.393	96.755	94.387	103.874	112.152	116.538	118.016	
001	PNGASW	World	Commodity Natural Gas Price Index includes European, Japanese, and American Natural Gas Price Indices		Index, 2005=100			n/a	n/a	n/a	n/a	n/a	n/a	n/a	n/a	n/a	n/a	n/a	n/a	38.099	40.460	36.430	39.815	44.563	42.702	34.394	33.774	60.083	60.110	47.971	62.978	69.819	100.000	115.309	116.868	173.657	109.642	113.333	154.308	171.230	164.936	159.948	106.512	93.260	93.717	93.945	94.047	94.326	
001	PNGASEU	World	Natural Gas, Russian Natural Gas border price in Germany, US$ per million metric British thermal units of gas		U.S. dollars	Units		n/a	n/a	n/a	n/a	n/a	3.810	3.440	2.130	1.900	1.589	2.035	3.008	2.365	2.598	2.312	2.696	2.750	2.670	2.245	1.807	3.454	3.873	2.666	3.486	3.755	5.915	8.213	8.143	13.138	8.855	8.223	10.597	11.981	11.189	10.463	7.518	6.530	6.530	6.530	6.530	6.530	
001	PNGASJP	World	Natural Gas, Indonesian Liquified Natural Gas in Japan, US$ per million metric British thermal units of liquid		U.S. dollars	Units		n/a	n/a	n/a	n/a	n/a	n/a	n/a	n/a	n/a	n/a	n/a	n/a	3.744	3.598	3.285	3.557	3.903	3.761	2.754	3.343	5.235	4.669	4.427	4.981	5.891	7.033	8.049	8.411	11.591	7.491	9.381	15.553	18.145	17.339	16.998	10.275	8.650	8.650	8.650	8.650	8.650	
001	PNGASUS	World	Natural Gas, Natural Gas spot price at the Henry Hub terminal in Louisiana, US$ per million metric British thermal units of gas		U.S. dollars	Units		n/a	n/a	n/a	n/a	n/a	n/a	n/a	n/a	n/a	n/a	n/a	1.451	1.751	2.114	1.915	1.704	2.689	2.460	2.088	2.261	4.308	3.959	3.361	5.495	5.908	8.862	6.741	6.976	8.858	3.945	4.389	3.999	2.755	3.725	4.371	2.821	3.042	3.192	3.267	3.300	3.392	
001	PCOALW	World	Commodity Coal Price Index includes Australian and South African Coal		Index, 2005=100			n/a	n/a	n/a	n/a	n/a	n/a	n/a	n/a	n/a	n/a	76.442	75.853	72.975	60.807	63.013	76.986	74.213	68.607	57.450	51.101	52.648	65.303	53.682	56.828	112.608	100.000	104.400	137.556	265.750	148.721	205.943	254.381	202.116	176.805	149.111	128.121	137.103	137.103	137.103	137.103	137.103	
001	PCOALAU	World	Coal, Australian thermal coal, 1200- btu/pound, less than 1% sulfur, 14% ash, FOB Newcastle/Port Kembla, US$ per metric tonne		U.S. dollars	Units		42.935	50.818	54.768	38.188	30.958	33.750	31.125	27.500	34.875	38.000	39.667	39.667	38.563	31.333	32.300	39.372	38.074	35.099	29.231	25.892	26.250	32.313	27.060	27.954	56.730	51.022	52.596	70.428	136.183	76.976	106.035	130.123	103.247	90.602	75.139	64.770	70.583	70.583	70.583	70.583	70.583	
001	PCOALSA	World	Coal, South African export price, US$ per metric tonne		U.S. dollars	Units		n/a	n/a	n/a	n/a	n/a	n/a	n/a	n/a	n/a	n/a	32.875	31.500	28.833	26.958	28.563	35.229	33.518	31.349	26.839	24.273	26.570	33.864	26.011	30.076	54.684	46.197	50.694	62.651	120.598	64.683	91.623	116.297	92.920	80.239	72.338	61.393	61.028	61.028	61.028	61.028	61.028	
001	PFANDBW	World	Commodity Food and Beverage Price Index includes Food and Beverage Price Indices		Index, 2005=100			129.136	119.947	110.497	111.377	110.917	100.739	100.880	104.172	111.058	100.718	102.006	96.500	94.164	94.023	101.487	106.016	110.866	105.117	94.161	80.982	80.464	79.481	82.375	87.966	99.045	100.000	110.000	126.147	156.871	136.124	152.646	182.400	174.809	174.616	170.968	144.298	138.109	139.670	139.636	138.679	137.769	
001	PFOODW	World	Commodity Food Price Index includes Cereal, Vegetable Oils, Meat, Seafood, Sugar, Bananas, and Oranges Price Indices		Index, 2005=100			125.055	118.702	108.557	108.002	105.025	95.841	94.246	102.135	110.395	101.123	103.698	98.240	96.590	95.990	98.994	103.797	111.381	102.364	91.424	79.712	80.981	80.982	82.461	88.234	100.599	100.000	110.176	126.455	157.398	134.142	150.091	179.892	175.615	177.561	170.203	141.557	134.911	136.495	136.586	135.829	135.112	
001	PCEREW	World	Commodity Cereals Price Index includes Wheat, Maize (Corn), Rice, and Barley		Index, 2005=100			121.942	127.207	103.260	110.112	107.592	92.036	76.288	73.768	97.834	108.159	95.903	94.591	98.861	92.486	99.157	117.510	140.990	108.789	93.319	81.564	78.845	82.460	94.201	95.360	102.986	100.000	121.298	158.736	222.631	162.381	166.479	231.239	236.376	218.260	180.304	144.941	136.357	140.997	142.871	142.302	141.726	
001	PWHEAMT	World	Wheat, No.1 Hard Red Winter, ordinary protein, FOB Gulf of Mexico, US$ per metric tonne		U.S. dollars	Units		172.726	174.961	160.355	157.416	152.333	135.829	114.916	112.895	145.199	169.243	135.523	128.658	151.161	140.212	149.783	176.960	207.142	159.665	126.096	112.050	114.004	126.805	148.528	146.142	156.882	152.439	191.721	255.206	325.940	223.431	223.674	316.199	313.250	312.231	284.895	207.853	192.709	202.195	205.210	203.500	201.790	
001	PMAIZMT	World	Maize (corn), U.S. No.2 Yellow, FOB Gulf of Mexico, U.S. price, US$ per metric tonne		U.S. dollars	Units		125.716	130.604	108.099	135.984	135.820	112.331	87.791	75.521	106.950	111.368	109.280	107.473	104.213	102.040	107.778	123.451	164.523	117.172	101.618	90.294	88.219	89.609	99.333	105.187	111.778	98.406	121.589	163.259	223.248	165.542	186.007	291.781	298.410	258.957	192.881	163.994	157.178	164.399	167.810	167.810	167.810	
001	PRICENPQ	World	Rice, 5 percent broken milled white rice, Thailand nominal price quote, US$ per metric tonne		U.S. dollars	Units		433.667	482.833	293.375	276.833	252.250	217.417	195.667	214.417	277.250	299.750	270.667	293.667	267.667	237.250	269.458	320.801	338.064	302.469	305.424	248.968	203.695	172.705	191.826	199.461	245.783	287.811	303.515	332.393	700.200	589.376	520.556	551.711	580.236	518.812	426.475	390.443	340.370	340.370	340.370	340.370	340.370	
001	PBARL	World	Barley, Canadian no.1 Western Barley, spot price, US$ per metric tonne		U.S. dollars	Units		78.229	79.726	63.712	70.891	78.723	58.816	47.560	55.001	70.333	75.139	79.926	78.287	78.675	71.377	72.649	104.012	119.665	97.237	85.054	75.937	77.235	93.936	108.967	104.718	98.989	95.077	116.615	172.381	200.476	128.381	158.374	207.219	238.229	206.360	146.089	128.511	143.250	138.420	137.830	137.130	136.340	
