WEO Country Group Code	WEO Subject Code	Country Group Name	Subject Descriptor	Subject Notes	Units	Scale	Series-specific Notes	1980	1981	1982	1983	1984	1985	1986	1987	1988	1989	1990	1991	1992	1993	1994	1995	1996	1997	1998	1999	2000	2001	2002	2003	2004	2005	2006	2007	2008	2009	2010	2011	2012	2013	2014	2015	2016	2017	Estimates Start After
001	NGDP_RPCH	World	Gross domestic product, constant prices		Percent change			1.844	2.234	0.703	2.779	4.919	3.940	3.452	3.763	4.486	3.829	3.224	2.206	2.193	2.128	3.380	3.276	3.762	4.133	2.580	3.553	4.738	2.352	2.885	3.679	4.869	4.544	5.248	5.400	2.761	-0.611	5.265	3.851	3.533	4.073	4.364	4.547	4.623	4.663	
001	NGDP_RPCHMK	World	Gross domestic product, constant prices		Percent change (market exchange rates)			1.457	2.181	0.441	2.716	4.905	3.879	3.235	3.533	4.554	3.858	3.139	1.691	2.397	1.552	3.217	2.829	3.208	3.575	2.133	3.183	4.223	1.669	1.974	2.748	3.866	3.400	3.990	3.971	1.447	-2.247	4.183	2.837	2.720	3.313	3.650	3.841	3.916	3.938	
001	NGDPD	World	Gross domestic product, current prices		U.S. dollars	Billions		10,705.477	10,930.965	10,829.132	11,096.944	11,534.012	11,945.191	14,078.119	16,166.229	18,141.185	19,042.944	22,175.384	23,246.914	24,325.535	24,960.584	26,784.297	29,774.181	30,501.518	30,370.174	30,156.544	31,337.733	32,299.020	32,090.903	33,357.749	37,484.384	42,136.202	45,571.189	49,342.423	55,677.539	61,166.629	57,760.763	63,074.924	69,659.626	71,896.504	75,522.071	79,504.622	83,940.909	88,743.877	94,028.240	
001	NGDP_D	World	Gross domestic product, deflator		Index, 2000=100																																									
001	NGAP_NPGDP	World	Output gap		Percent of potential GDP																																									
001	PPPGDP	World	Gross domestic product based on purchasing-power-parity (PPP) valuation of country GDP		Current international dollar	Billions		11,328.167	12,647.192	13,492.846	14,396.874	15,655.310	16,756.848	17,703.466	18,885.790	20,383.440	21,938.769	23,504.999	24,830.634	27,883.164	29,087.768	30,632.319	32,406.550	34,236.600	36,300.111	37,632.791	39,512.276	42,293.168	44,234.846	46,214.873	48,875.880	52,658.078	56,794.464	61,638.178	66,754.974	70,029.899	70,138.989	74,604.114	78,897.426	82,646.727	87,251.023	92,348.696	98,041.193	104,174.073	111,088.288	
001	PPPPC	World	Gross domestic product based on purchasing-power-parity (PPP) per capita GDP		Current international dollar	Units																																								
001	PPPSH	World	Gross domestic product based on purchasing-power-parity (PPP) share of world total	These data form the basis for the country weights used to generate the World Economic Outlook country group composites for the domestic economy.   Please note:   The IMF is not a primary source for purchasing power parity (PPP) data. WEO weights have been created from primary sources and are used solely for purposes of generating country group composites. For primary source information, please refer to one of the following sources: the Organization for Economic Cooperation and Development, the World Bank, or the Penn World Tables.  For further information see Box A2 in the April 2004 World Economic Outlook, Box 1.2 in the September 2003 World Economic Outlook for a discussion on the measurement of global growth and Box A.1 in the May 2000 World Economic Outlook for a summary of the revised PPP-based weights, and Annex IV of the May 1993 World Economic Outlook. See also Anne Marie Gulde and Marianne Schulze-Ghattas, "Purchasing Power Parity Based Weights for the World Economic Outlook," in Staff Studies for the World Economic Outlook (Washington: IMF, December 1993), pp. 106-23.	Percent																																									
001	NID_NGDP	World	Investment		Percent of GDP			25.042	24.698	22.799	22.275	23.294	22.961	22.781	23.023	23.931	24.332	24.201	23.501	22.520	22.507	22.754	22.924	22.657	22.766	22.278	22.136	22.509	21.584	21.030	21.236	22.083	22.437	23.167	23.736	23.799	21.720	22.836	23.477	24.045	24.539	24.934	25.336	25.682	26.006	
001	NGSD_NGDP	World	Gross national savings		Percent of GDP			23.555	23.394	21.532	20.740	21.849	21.334	21.251	21.858	23.053	23.015	22.397	21.749	21.350	21.661	22.061	22.470	22.468	22.775	22.166	21.894	22.312	21.318	20.658	20.941	22.065	22.600	23.992	24.246	24.098	21.885	23.280	23.971	24.361	24.834	25.116	25.416	25.669	25.989	
001	PCPIPCH	World	Inflation, average consumer prices		Percent change			17.437	15.424	14.752	14.280	15.701	14.998	11.403	14.331	19.776	24.985	27.677	17.067	34.637	34.766	27.612	14.509	8.670	6.156	5.580	5.446	4.548	4.242	3.532	3.706	3.586	3.718	3.707	4.046	5.994	2.475	3.684	4.839	4.040	3.660	3.440	3.355	3.287	3.317	
001	PCPIEPCH	World	Inflation, end of period consumer prices		Percent change			n/a	n/a	n/a	n/a	n/a	n/a	n/a	n/a	n/a	26.929	25.901	18.072	36.718	37.049	22.667	11.411	7.477	5.396	6.449	4.508	4.531	3.554	3.983	3.298	3.814	3.781	3.552	5.031	4.352	3.130	4.193	4.446	3.984	3.406	3.372	3.293	3.290	3.266	
001	FLIBOR3	World	Three-month London interbank offered rate (LIBOR)		Percent																																									
001	TRADEPCH	World	Trade volume of goods and services		Percent change			3.314	3.342	-1.780	1.984	8.955	3.026	3.639	6.552	8.587	8.236	6.858	4.890	5.695	3.520	9.530	9.932	7.118	10.341	4.855	5.781	12.279	0.235	3.869	5.302	10.589	7.767	9.304	7.908	2.927	-10.535	12.875	5.807	4.024	5.629	6.110	6.380	6.396	6.490	
001	TM_RPCH	World	Volume of imports of goods and services		Percent change			1.889	2.451	-1.848	2.086	9.246	2.864	3.969	7.026	8.634	8.632	6.312	4.446	5.282	3.026	10.015	10.339	7.355	9.754	4.925	6.122	12.213	0.230	3.890	5.474	10.825	7.793	8.929	7.882	3.014	-10.876	12.728	5.819	4.155	5.597	6.110	6.385	6.380	6.450	
001	TMG_RPCH	World	Volume of imports of goods		Percent change			1.648	1.208	-1.494	2.591	10.245	3.774	5.482	7.054	9.704	7.209	6.424	4.744	6.802	3.600	10.418	10.288	7.059	10.333	5.288	6.451	12.691	-0.447	4.268	6.153	11.223	7.979	8.971	7.392	2.396	-11.867	14.216	6.590	3.744	5.587	6.299	6.644	6.595	6.643	
001	TX_RPCH	World	Volume of exports of goods and services		Percent change			4.796	4.242	-1.713	1.882	8.666	3.189	3.310	6.076	8.539	7.836	7.415	5.339	6.107	4.011	9.052	9.528	6.882	10.931	4.785	5.442	12.346	0.241	3.848	5.130	10.353	7.740	9.681	7.934	2.841	-10.193	13.022	5.796	3.893	5.662	6.110	6.376	6.412	6.529	
001	TXG_RPCH	World	Volume of exports of goods		Percent change			4.234	3.984	-2.314	2.291	8.957	3.220	3.349	6.225	9.674	6.958	6.522	5.234	6.452	4.175	9.568	10.163	6.320	11.421	4.945	5.297	13.002	-0.135	3.843	5.420	9.922	7.565	9.429	7.066	2.478	-11.440	14.395	5.973	3.731	5.545	6.115	6.409	6.452	6.573	
001	TTPCH	World	Terms of trade of goods and services		Percent change																																									
001	TTTPCH	World	Terms of trade of goods		Percent change																																									
001	TXGM_D	World	Export price of manufactures		U.S. dollars; index, 2000=100																																									
001	TXGM_DPCH	World	Export price of manufactures		U.S. dollars; annual percent change																																									
001	LUR	World	Unemployment rate		Percent of total labor force																																									
001	LE	World	Employment		Index, 2000=100																																									
001	GGR_NGDP	World	General government revenue	Revenue consists of taxes, social contributions, grants receivable, and other revenue. Revenue increases government?s net worth, which is the difference between its assets and liabilities (GFSM 2001, paragraph 4.20). Note: Transactions that merely change the composition of the balance sheet do not change the net worth position, for example, proceeds from sales of nonfinancial and financial assets or incurrence of liabilities.	Percent of GDP																																									
001	GGX_NGDP	World	General government total expenditure	Total expenditure consists of total expense and the net acquisition of nonfinancial assets. Note: Apart from being on an accrual basis, total expenditure differs from the GFSM 1986 definition of total expenditure in the sense that it also takes the disposals of nonfinancial assets into account.	Percent of GDP																																									
001	GGXCNL_NGDP	World	General government net lending/borrowing	Net lending (+)/ borrowing (?) is calculated as revenue minus total expenditure. This is a core GFS balance that measures the extent to which general government is either putting financial resources at the disposal of other sectors in the economy and nonresidents (net lending), or utilizing the financial resources generated by other sectors and nonresidents (net borrowing). This balance may be viewed as an indicator of the financial impact of general government activity on the rest of the economy and nonresidents (GFSM 2001, paragraph 4.17). Note: Net lending (+)/borrowing (?) is also equal to net acquisition of financial assets minus net incurrence of liabilities.	Percent of GDP																																									
001	GGSB_NPGDP	World	General government structural balance		Percent of potential GDP																																									
001	GGXONLB_NGDP	World	General government primary net lending/borrowing	Primary net lending/borrowing is net lending (+)/borrowing (?) plus net interest payable/paid (interest expense minus interest revenue).	Percent of GDP																																									
001	GGXWDN_NGDP	World	General government net debt	Net debt is calculated as gross debt minus financial assets corresponding to debt instruments. These financial assets are: monetary gold and SDRs, currency and deposits, debt securities, loans, insurance, pension, and standardized guarantee schemes, and other accounts receivable.	Percent of GDP																																									
001	GGXWDG_NGDP	World	General government gross debt	Gross debt consists of all liabilities that require payment or payments of interest and/or principal by the debtor to the creditor at a date or dates in the future. This includes debt liabilities in the form of SDRs, currency and deposits, debt securities, loans, insurance, pensions and standardized guarantee schemes, and other accounts payable. Thus, all liabilities in the GFSM 2001 system are debt, except for equity and investment fund shares and financial derivatives and employee stock options. Debt can be valued at current market, nominal, or face values (GFSM 2001, paragraph 7.110).	Percent of GDP																																									
001	BCA	World	Current account balance	Current account is all transactions other than those in financial and capital items. The major classifications are goods and services, income and current transfers. The focus of the BOP is on transactions (between an economy and the rest of the world) in goods, services, and income. Data for the world total reflects errors, omissions, and asymmetries in balance of payments statistics on current account, as well as the exclusion of data for international organizations and a limited number of countries. Calculated as the sum of the balance of individual countries.	U.S. dollars	Billions		-58.440	-72.744	-83.001	-70.318	-75.134	-82.755	-79.585	-73.404	-74.024	-96.288	-106.450	-135.491	-115.899	-63.740	-63.414	-60.348	-48.952	2.569	-79.737	-114.429	-166.875	-165.137	-128.486	-63.711	7.998	16.065	210.561	308.959	179.915	207.929	315.292	373.520	292.782	292.945	209.768	133.878	50.555	15.437	
001	BCA_NGDPD	World	Current account balance		Percent of GDP																																									
001	BM	World	Imports of goods and services		U.S. dollars	Billions		-2,317.293	-2,304.608	-2,160.611	-2,101.866	-2,213.874	-2,232.699	-2,466.727	-2,926.045	-3,279.255	-3,552.010	-4,099.956	-4,272.691	-4,686.604	-4,666.529	-5,198.370	-6,232.551	-6,576.225	-6,809.069	-6,769.777	-7,106.443	-7,966.445	-7,724.817	-8,053.582	-9,336.291	-11,308.064	-12,839.386	-14,681.968	-17,001.992	-19,581.884	-15,586.253	-18,498.553	-21,699.534	-22,543.705	-23,794.198	-25,243.161	-26,886.830	-28,732.744	-30,714.960	
001	BX	World	Exports of goods and services		U.S. dollars	Billions		2,293.249	2,286.263	2,123.708	2,066.208	2,178.821	2,206.793	2,454.573	2,927.714	3,280.500	3,542.546	4,107.065	4,256.053	4,701.879	4,719.383	5,280.921	6,328.224	6,676.495	6,936.623	6,844.693	7,092.159	7,899.731	7,634.821	8,011.661	9,327.992	11,317.093	12,869.912	14,847.717	17,295.458	19,791.875	15,808.813	18,820.672	22,095.462	22,847.769	24,063.289	25,378.583	26,899.298	28,627.697	30,552.711	
001	BFXP	World	Private financial flows, net	Net private financial flows comprises net private direct investment, net private portfolio flows, and net other private financial flows.	U.S. dollars	Billions																																								
001	BFPP	World	Private portfolio flows, net		U.S. dollars	Billions																																								
001	BFD	World	Direct investment, net		U.S. dollars	Billions																																								
001	BFOP	World	Other private financial flows, net	Net other private financial flows is the difference between net other investment and net other official investment.	U.S. dollars	Billions																																								
001	BFXG	World	Official flows, net		U.S. dollars	Billions																																								
001	BFRA	World	Change in reserves	Measured as flows. Comprises monetary gold, SDRs, reserve position in the Fund, foreign exchange assets, and other claims. Official holdings of gold are valued at SDR 35 an ounce. This convention results in a marked underestimation of reserves for countries that have substantial gold holdings. Securities not included are included in direct investment and portfolio investment. A minus sign indicates an increase.	U.S. dollars	Billions																																								
001	D	World	External debt, total		U.S. dollars	Billions																																								
001	D_NGDPD	World	External debt, total		Percent of GDP																																									
001	D_BX	World	External debt, total		Percent of exports of goods and services																																									
001	DS	World	External debt, total debt service		U.S. dollars	Billions																																								
001	DS_NGDPD	World	External debt, total debt service		Percent of GDP																																									
001	DS_BX	World	External debt, total debt service		Percent of exports of goods and services																																									
001	DSI	World	External debt, total debt service, interest		U.S. dollars	Billions																																								
001	DSI_NGDPD	World	External debt, total debt service, interest		Percent of GDP																																									
001	DSI_BX	World	External debt, total debt service, interest		Percent of exports of goods and services																																									
001	DSP	World	External debt, total debt service, amortization		U.S. dollars	Billions																																								
001	DSP_NGDPD	World	External debt, total debt service, amortization		Percent of GDP																																									
001	DSP_BX	World	External debt, total debt service, amortization		Percent of exports of goods and services																																									
001	PALLFNFW	World	Commodity Price Index includes both Fuel and Non-Fuel Price Indices		Index, 2005=100			n/a	n/a	n/a	n/a	n/a	n/a	n/a	n/a	n/a	n/a	n/a	n/a	54.874	52.514	54.703	59.170	62.161	59.467	47.753	49.917	63.264	58.279	58.300	65.045	80.486	100.000	120.712	134.966	172.168	120.519	151.983	191.708	195.689	188.901	n/a	n/a	n/a	n/a	
001	PNFUELW	World	Commodity Non-Fuel Price Index includes Food and Beverages and Industrial Inputs Price Indices		Index, 2005=100			101.200	90.491	82.544	86.454	85.948	77.183	78.757	88.229	102.438	95.741	94.048	86.327	84.572	84.722	93.529	100.587	99.383	95.838	83.294	76.380	79.626	75.828	77.299	81.826	94.285	100.000	123.242	140.563	151.135	127.404	160.965	189.591	170.068	166.499	n/a	n/a	n/a	n/a	
001	PINDUW	World	Commodity Industrial Inputs Price Index includes Agricultural Raw Materials and Metals Price Indices		Index, 2005=100			72.982	60.739	54.307	61.280	60.728	53.391	56.413	72.124	93.731	90.712	86.009	75.910	74.372	75.028	85.223	94.569	87.192	86.270	71.735	71.329	77.741	72.591	71.379	75.331	89.158	100.000	136.324	154.342	145.667	118.726	170.040	197.871	175.333	172.649	n/a	n/a	n/a	n/a	
001	POILAPSP	World	Crude Oil (petroleum), Simple average of three spot prices (APSP); Dated Brent, West Texas Intermediate, and the Dubai Fateh	The APSP denotes an equally weighted average of three crude oil spot prices?West Texas Intermediate (?WTI?), Dated Brent (?Brent?), and Dubai Fateh (?Dubai?). The prices of these crude oils tend to move together according to the inequality WTI > Brent > Dubai. Their price differentials reflect differences in American Petroleum Institute (API) measure of gravity, sulfur content, and overall weight. The WTI spot price refers to the physical delivery price for a barrel of WTI deliverable to Cushing, Oklahoma. The WTI price is frequently mentioned in the financial press, and is often described as the ?headline? oil price. The Brent spot price is the physical delivery price for a barrel of either Dated Brent (UK), Forties (Norway), or Oseberg (Norway) to Sullom Voe, United Kingdom (in the Shetland Islands). The Dubai Fateh spot price refers to the physical price for a barrel of Dubai Fateh deliverable in the Arabian Gulf at Dubai, United Arab Emirates.	Dollars per barrel			35.707	34.038	31.544	29.469	28.546	27.371	14.172	18.198	14.769	17.906	22.985	19.368	19.036	16.787	15.948	17.204	20.373	19.268	13.074	17.981	28.234	24.331	24.950	28.892	37.760	53.354	64.273	71.128	97.035	61.777	79.030	104.011	114.712	109.997	n/a	n/a	n/a	n/a	
001	PNRGW	World	Commodity Fuel (energy) Index includes Crude oil (petroleum), Natural Gas, and Coal Price Indices		Index, 2005=100			n/a	n/a	n/a	n/a	n/a	n/a	n/a	n/a	n/a	n/a	n/a	n/a	37.499	33.671	31.988	34.939	40.386	38.189	26.961	34.435	53.692	48.012	47.185	55.228	72.414	100.000	119.233	131.692	184.472	116.492	146.727	192.947	210.679	202.006	n/a	n/a	n/a	n/a	
001	POILAPSPW	World	Crude Oil (petroleum), Price index simple average of three spot prices (APSP); Dated Brent, West Texas Intermediate, and the Dubai Fateh	The APSP denotes an equally weighted average of three crude oil spot prices?West Texas Intermediate (?WTI?), Dated Brent (?Brent?), and Dubai Fateh (?Dubai?). The prices of these crude oils tend to move together according to the inequality WTI > Brent > Dubai. Their price differentials reflect differences in American Petroleum Institute (API) measure of gravity, sulfur content, and overall weight. The WTI spot price refers to the physical delivery price for a barrel of WTI deliverable to Cushing, Oklahoma. The WTI price is frequently mentioned in the financial press, and is often described as the ?headline? oil price. The Brent spot price is the physical delivery price for a barrel of either Dated Brent (UK), Forties (Norway), or Oseberg (Norway) to Sullom Voe, United Kingdom (in the Shetland Islands). The Dubai Fateh spot price refers to the physical price for a barrel of Dubai Fateh deliverable in the Arabian Gulf at Dubai, United Arab Emirates.	Index, 2005=100			66.924	63.797	59.122	55.233	53.503	51.300	26.561	34.109	27.681	33.560	43.080	36.300	35.678	31.463	29.891	32.245	38.185	36.112	24.504	33.701	52.918	45.602	46.763	54.151	70.772	100.000	120.464	133.312	181.870	115.787	148.124	194.944	215.001	206.164	n/a	n/a	n/a	n/a	
001	PNGASW	World	Commodity Natural Gas Price Index includes European, Japanese, and American Natural Gas Price Indices		Index, 2005=100			n/a	n/a	n/a	n/a	n/a	n/a	n/a	n/a	n/a	n/a	n/a	n/a	38.099	40.460	36.430	39.815	44.563	42.702	34.394	33.774	60.083	60.110	47.971	62.978	69.819	100.000	115.309	116.868	173.657	109.642	113.333	154.319	172.669	176.525	n/a	n/a	n/a	n/a	
001	PNGASEUW	World	Natural Gas, Price index Russian Natural Gas border price in Germany		Index, 2005=100			n/a	n/a	n/a	n/a	n/a	64.413	58.157	36.010	32.122	26.862	34.404	50.845	39.983	43.928	39.096	45.581	46.492	45.146	37.954	30.549	58.392	65.481	45.078	58.940	63.483	100.000	138.842	137.658	222.105	149.704	139.011	179.149	207.101	209.918	n/a	n/a	n/a	n/a	
001	PNGASJPW	World	Natural Gas, Price index Indonesian Liquefied Natural Gas in Japan		Index, 2005=100			n/a	n/a	n/a	n/a	n/a	n/a	n/a	n/a	n/a	n/a	n/a	n/a	53.235	51.155	46.712	50.575	55.492	53.478	39.163	47.529	74.440	66.394	62.946	70.826	83.766	100.000	114.457	119.599	164.818	106.517	133.393	221.164	256.820	256.820	n/a	n/a	n/a	n/a	
001	PNGASUSW	World	Natural Gas, Price index Natural Gas spot price at the Henry Hub terminal in Louisiana		Index, 2005=100			n/a	n/a	n/a	n/a	n/a	n/a	n/a	n/a	n/a	n/a	n/a	16.370	19.755	23.857	21.608	19.234	30.347	27.761	23.560	25.514	48.607	44.674	37.924	62.009	66.668	100.000	76.069	78.715	99.957	44.514	49.527	45.172	29.856	39.338	n/a	n/a	n/a	n/a	
001	PCOALW	World	Commodity Coal Price Index includes Australian and South African Coal		Index, 2005=100			n/a	n/a	n/a	n/a	n/a	n/a	n/a	n/a	n/a	n/a	76.485	75.894	73.013	60.842	63.050	77.032	74.257	68.648	57.485	51.133	52.682	65.347	53.716	56.823	112.678	100.000	104.449	137.623	265.906	148.846	205.967	253.689	222.429	184.216	n/a	n/a	n/a	n/a	
001	PCOALAUW	World	Coal, Price Index Australian thermal coal, 1200- btu/pound, less than 1% sulfur, 14% ash, FOB Newcastle/Port Kembla		Index, 2005=100			84.151	99.600	107.342	74.846	60.677	66.148	61.003	53.899	68.353	74.478	77.745	77.745	75.581	61.412	63.306	77.167	74.624	68.793	57.291	50.746	51.449	63.331	53.036	54.788	111.186	100.000	103.087	138.036	266.911	150.975	207.820	253.989	227.354	191.095	n/a	n/a	n/a	n/a	
001	PCOALSAW	World	Coal, Price Index South African export price		Index, 2005=100			n/a	n/a	n/a	n/a	n/a	n/a	n/a	n/a	n/a	n/a	71.374	68.389	62.600	58.529	62.012	76.485	72.769	68.062	58.270	52.699	57.686	73.522	56.472	65.075	118.726	100.000	109.972	135.948	261.829	140.210	198.451	252.473	202.453	156.318	n/a	n/a	n/a	n/a	
001	PFANDBW	World	Commodity Food and Beverage Price Index includes Food and Beverage Price Indices		Index, 2005=100			129.136	119.947	110.497	111.377	110.917	100.739	100.880	104.172	111.058	100.718	102.006	96.640	94.671	94.319	101.751	106.545	111.451	105.310	94.738	81.382	81.492	79.032	83.159	88.256	99.360	100.000	110.289	126.921	156.548	135.995	151.981	181.393	164.855	160.411	n/a	n/a	n/a	n/a	
001	PFOODW	World	Commodity Food Price Index includes Cereal, Vegetable Oils, Meat, Seafood, Sugar, Bananas, and Oranges Price Indices		Index, 2005=100			125.055	118.702	108.557	108.002	105.025	95.841	94.246	102.135	110.395	101.123	103.698	98.395	97.151	96.318	99.286	104.383	112.030	102.579	92.064	80.156	82.121	80.485	83.330	88.556	100.948	100.000	110.496	127.312	157.041	133.999	149.354	178.776	165.392	160.195	n/a	n/a	n/a	n/a	
001	PCEREW	World	Commodity Cereals Price Index includes Wheat, Maize (Corn), Rice, and Barley		Index, 2005=100			121.942	127.207	103.260	110.112	107.592	92.036	76.288	73.768	97.834	108.159	95.903	94.591	98.861	92.486	99.157	117.510	140.990	108.789	93.319	81.564	78.845	82.460	94.201	95.360	102.986	100.000	121.298	158.736	222.631	162.381	166.479	231.318	199.627	193.692	n/a	n/a	n/a	n/a	
001	PWHEAMTW	World	Wheat, Price index No.1 Hard Red Winter, ordinary protein, FOB Gulf of Mexico		Index, 2005=100			113.308	114.775	105.193	103.265	99.931	89.104	75.385	74.059	95.250	111.024	88.903	84.400	99.162	91.979	98.258	116.086	135.885	104.740	82.719	73.505	74.787	83.184	97.434	95.869	102.914	100.000	125.769	167.415	213.817	146.571	146.730	207.486	165.927	172.692	n/a	n/a	n/a	n/a	
001	PMAIZMTW	World	Maize (corn), Price Index U.S. No.2 Yellow, FOB Gulf of Mexico, U.S. price		Index, 2005=100			127.753	132.720	109.850	138.188	138.021	114.151	89.213	76.745	108.683	113.173	111.050	109.214	105.901	103.693	109.524	125.451	167.189	119.071	103.264	91.757	89.649	91.061	100.943	106.891	113.589	100.000	123.559	165.904	226.865	168.224	189.021	296.684	253.288	227.883	n/a	n/a	n/a	n/a	
001	PRICENPQW	World	Rice, Price Index 5% broken milled white rice, Thailand nominal price quote		Index, 2005=100			150.677	167.760	101.933	96.186	87.644	75.541	67.984	74.499	96.330	104.148	94.043	102.034	93.001	82.432	93.623	111.462	117.460	105.093	106.119	86.504	70.774	60.006	66.650	69.303	85.397	100.000	105.456	115.490	243.284	204.779	180.867	191.692	186.320	177.286	n/a	n/a	n/a	n/a	
001	PBARLW	World	Barley, Price Index Canadian no.1 Western Barley, spot price		Index, 2005=100			82.279	83.854	67.011	74.561	82.799	61.862	50.022	57.849	73.975	79.029	84.064	82.340	82.749	75.073	76.411	109.397	125.861	102.272	89.458	79.869	81.234	98.800	114.610	110.140	104.114	100.000	122.653	181.307	210.856	135.029	166.575	217.949	232.443	231.391	n/a	n/a	n/a	n/a	
001	PVOILW	World	Commodity Vegetable Oil Index includes Soybean, Soybean Meal, Soybean Oil, Rapeseed Oil, Palm Oil, Sunflower Oil, Olive Oil, Fishmeal, and Groundnut Price Indices		Index, 2005=100			110.392	107.202	87.665	102.129	110.604	85.953	71.903	76.267	103.344	92.512	86.029	84.721	83.989	90.705	98.748	103.527	113.914	114.545	103.033	77.837	74.406	71.491	82.547	98.821	114.007	100.000	103.425	143.434	192.542	153.973	170.374	209.122	206.589	201.624	n/a	n/a	n/a	n/a	
001	PSOYBW	World	Soybeans, Price Index U.S. soybeans, Chicago Soybean futures contract (first contract forward) No. 2 yellow and par		Index, 2005=100			118.905	117.151	99.174	116.350	115.404	90.968	84.679	87.618	125.362	110.690	98.192	93.567	94.026	103.139	102.858	100.395	124.346	125.755	100.070	78.392	82.037	75.629	84.643	104.515	124.006	100.000	97.455	142.211	203.158	169.651	172.519	217.023	215.678	210.188	n/a	n/a	n/a	n/a	
